{
  "$schema": "https://json-schema.org/draft/2020-12/schema",
  "type": "object",
  "properties": {
    "name": {
      "type": "string",
      "minLength": 1
    },
    "location": {
      "type": "string",
      "minLength": 1
    },
    "email": {
      "type": "string",
      "format": "email",
      "pattern": "^(?:[A-Za-z0-9_'+\\-]+\\.)*[A-Za-z0-9_'+\\-]*[A-Za-z0-9_+-]@(?:[A-Za-z0-9][A-Za-z0-9\\-]*\\.)+[A-Za-z]{2,}$"
    },
    "social_networks": {
      "type": "array",
      "items": {
        "type": "object",
        "properties": {
          "network": {
            "type": "string",
            "minLength": 1
          },
          "username": {
            "type": "string",
            "minLength": 1
          }
        },
        "required": [
          "network",
          "username"
        ],
        "additionalProperties": {}
      }
    },
    "sections": {
      "type": "object",
      "properties": {
        "education": {
          "minItems": 1,
          "type": "array",
          "items": {
            "type": "object",
            "properties": {
              "institution": {
                "type": "string",
                "minLength": 1
              },
              "area": {
                "type": "string",
                "minLength": 1
              },
              "degree": {
                "type": "string",
                "minLength": 1
              },
              "location": {
                "type": "string"
              },
              "start_date": {
                "type": "string"
              },
              "end_date": {
                "type": "string"
              },
              "date": {
                "type": "string"
              },
              "highlights": {
                "type": "array",
                "items": {
                  "type": "string"
                }
              }
            },
            "required": [
              "institution",
              "area",
              "degree"
            ],
            "additionalProperties": {}
          }
        },
        "experience": {
          "minItems": 1,
          "type": "array",
          "items": {
            "type": "object",
            "properties": {
              "company": {
                "type": "string",
                "minLength": 1
              },
              "position": {
                "type": "string",
                "minLength": 1
              },
              "location": {
                "type": "string"
              },
              "start_date": {
                "type": "string"
              },
              "end_date": {
                "type": "string"
              },
              "date": {
                "type": "string"
              },
              "highlights": {
                "type": "array",
                "items": {
                  "type": "string"
                }
              }
            },
            "required": [
              "company",
              "position"
            ],
            "additionalProperties": {}
          }
        },
        "skills": {
          "minItems": 1,
          "type": "array",
          "items": {
            "type": "object",
            "properties": {
              "label": {
                "type": "string",
                "minLength": 1
              },
              "details": {
                "type": "string",
                "minLength": 1
              }
            },
            "required": [
              "label",
              "details"
            ],
            "additionalProperties": {}
          }
        },
        "Awards & Open Source": {
          "type": "array",
          "items": {
            "type": "object",
            "properties": {
              "bullet": {
                "type": "string",
                "minLength": 1
              }
            },
            "required": [
              "bullet"
            ],
            "additionalProperties": {}
          }
        }
      },
      "required": [
        "education",
        "experience",
        "skills"
      ],
      "additionalProperties": {}
    }
  },
  "required": [
    "name",
    "location",
    "email",
    "social_networks",
    "sections"
  ],
  "additionalProperties": {},
  "title": "Resume snapshot",
  "description": "Subset of the RenderCV `cv` object read by tiencheng.dev. Generated by scripts/gen-schema.ts; do not edit."
}
